コストコのロングセラー商品『プルコギ」を使用してます！,ボウルに1・◎を加えてプルコギをほぐしておく,じゃがいも・人参は皮を剥き食べやすい大きさに、玉ねぎはくし形切りに切り、しらたきは食べやすい長さに切って鍋に入れる,3の上に2を広げながら汁ごと入れる,フタをして加熱し、沸騰したら弱火にして10分加熱したら火を止め、しばらく放置しておく（画像は分りやすくフタを開けてます）,器に盛り付け、ネギを散らしたら、出来上がり！,『コストコのプルコギで！レンチンチャプチェ』（ レシピID : 5283209  ）,『STAUBで！めんつゆ肉じゃが』（ レシピID : 3586850 ）,『STAUBで！塩肉じゃが』（ レシピID : 4751211 ）,『塩麹☆鶏肉じゃが』（ レシピID : 1772343 ）
野菜は好きなサイズに切る,フライパンに油を引いて、火の通りずらい野菜から炒める。,水と★の調味料を入れて沸騰させ、弱火でコトコト20〜30分煮込む,野菜を煮込んでる間に、豚こまと糸こんにゃくを下茹でしておく。,野菜がある程度煮詰まってきたら、糸こんにゃくを入れ煮込む。豚こまは、火を止める5〜10分前ぐらいに入れる。,火を止めしばらく冷まして完成(^O^)仕上げに胡椒をかける。
じゃが、にんじん、きりますにんじん、ななめ切り鍋半分の水とお酒一週入れたら煮込む,玉ねぎ、くしぎり、そのあと置いとく。お肉は切ったら、手に砂糖つけて揉んで放置,鍋が沸騰したらお砂糖を大さじ3くらい…？と塩ちょっといれてひたすら煮込む15分くらい…？適当、だそう。,しょうゆ、一週、みりん、二週、優しく入れる。いれすぎ注意！肉と玉ねぎ入れる。アクを取るorアク取り名人いれる,暫くとろ火で煮込む。水が半分位無くなるまで、らしい。味見て足りないものをいれる砂糖は追加しない、みりんで調節！,食べる直前にもう少し煮て、この時味を調整して決める。出来上がり！
干しシイタケと牛肉は食べやすい大きさに切る。人参は乱切りにする。じゃがいもは一口大に、玉ねぎはくし形に切る。,さやいんげんは塩ゆでして3〜4cm長さに切る。生キクラゲは一口大に切る。,フライパンを中火で熱してサラダ油を入れ、牛肉とAを炒める。牛肉の色が変わったら、じゃがいもと玉ねぎを加えて炒める。,Bを加えて煮立ったらアクを取り、干しシしてじゃがいもがやわらかくなるまで煮る。（約15分）,火を止めて粗熱が取れるまでおき、味をしみ込ませる。再び火にかけて2とオイスターソースを加え、一煮立ちさせる。
牛バラ肉は食べやすい大きさに切り、玉ねぎはくし切り、じゃがいもは食べやすい大きさに切る。,じゃがいもは耐熱容器に入れラップをして500wで2分間温めます。,鍋にサラダ油をひいて、牛バラ肉・たまねぎ・じゃがいもを炒める。（弱火）,牛バラ肉に火が通ったら、しょうゆ・酒・みりん・砂糖・水を入れてアルミホイルで落し蓋を作り15分煮込む。（弱火）,アルミホイルの蓋を取って3分間水気を飛ばす。（中火）,できあがり
人参は皮をむいて乱切りに、玉ねぎは5ミリ幅に切る。豚肉は食べやすい大きさに切る。,じゃがいもは一口大に切り面取をする。(ピーラーで優しくなぞると簡単に面取ができます。),じゃがいもはラップをかけレンジで温める。(600wで4分程度),深めのフライパンにごま油をひき豚肉を炒める。豚肉の色が変わったら人参と玉ねぎを加え玉ねぎがしなっとするまで炒める。,じゃがいもを加え、その後水とめんつゆを加え蓋をし中弱火で煮込む。(途中で様子を見ながらかき混ぜる。),煮汁が少なくなったら出来上がり！(煮込む時間は味を見ながらお好みで！),＊2018年9月27日「簡単 肉じゃが」で検索ワードトップ10になりました！ありがとうございます！
★干し椎茸は前日から水で戻しておく。じゃがいもは一口大、人参は乱切り、玉ねぎは櫛形切りにする。糸こんは水洗いし、切る。,鍋に油を敷いて、牛肉を炒め、色が変わったら玉ねぎも入れて炒める。透明になってきたら、じゃがいも、人参を入れる。,全体に油がまわったら、干し椎茸と糸こんも加え、調味料を加える。沸いたら落し蓋をして、弱火で10分〜煮る。,火が通って柔らかくなったら完成。お好みで、絹さやなどを一緒に入れると彩りも綺麗です。今回は余っていた飾り麩を入れてます
□材料（じゃがいも、にんじん、厚揚げ、きのこ）を食べやすい一口大に切り分ける。□たまねぎは薄切りにする。,●鍋にごま油を入れ、温める。●豚肉、たまねぎ、ジャガイモを炒める。●厚揚げ、、キノコを入れ、炒め合わせる。,●ジャガイモの表面に火が通ったら、合わせ調味料を加える。,●20分〜煮詰める。（途中で灰汁がでれば取り除く）●器にとり、できあがり。
じゃがいも、玉ねぎは皮をむいて4等分に、トマトも4等分にします。,絹さやはさっと湯がき、斜めに2等分にしておきます。,鍋に油を熱し、じゃがいも、玉ねぎの順に中火で炒めます。,牛肉を手でほぐしながら加え、トマトは上に重ねます。,酒、分量の水を加え、ひと煮立ちさせてアクを取ります。そこにさとうとみりんを加え、落し蓋をして中火で15分ほど煮ます。,しょうゆと塩を加え、再度落し蓋をして10分ほど煮ます。,皿に盛りつけ、②の絹さやを中央に飾ります。
